{"contract_version":"tacua.execution-revocations@1.0.0","expires_at":"2026-07-20T11:15:00Z","issued_at":"2026-07-20T10:58:00Z","issuer_id":"execution-issuer-synthetic","list_id":"execution-revocations-synthetic","media_type":"application/vnd.tacua.execution-revocations+json;version=1.0.0","revision":"revocation-revision-synthetic-001","revoked_assertion_ids":[],"revoked_key_ids":[],"revoked_nonces":[],"signature":{"algorithm":"hmac-sha256","key_id":"execution-key-synthetic-001","value":"hmac-sha256:f927394b832c74ff5cc698c3a7411a50d5b138eeb3f02e9740141dade999580f"}}
